{
  "run_id": "routine-deeper-than-wednesday-waiver-reconciliation-2026-09-23-001",
  "routine_folder": "deeper-than-wednesday-waiver-reconciliation",
  "started_at": "2026-09-23T13:28:15Z",
  "finished_at": "2026-09-23T13:30:50Z",
  "timezone": "America/Chicago",
  "nfl_week": 3,
  "coverage": {
    "league": "yahoo-ff-668216",
    "team": "Vaqueros",
    "team_id": 8,
    "mode": "scheduled_routine_confirming_prior_manual_reconciliation",
    "prior_reconciliation_sha": "f201746360f179de812b306b8e1e2c8479828da3",
    "prior_reconciliation_window_local": "2026-09-23T08:11:00-05:00/2026-09-23T08:12:00-05:00",
    "claims": {
      "success": [
        "Josh Downs $18",
        "Packers D/ST $3"
      ],
      "failed": [
        "Panthers D/ST $1",
        "Giants D/ST $1"
      ],
      "pending": []
    },
    "faab_remaining": 79,
    "yahoo_actions_taken": "none (read/reconcile only)"
  },
  "errors": [],
  "last_successful_source_refresh": "2026-09-23T13:12:00Z",
  "files_changed": [
    "grok/intel/yahoo-ff-668216/2026/outcomes/W03-2026-09-23-waiver-outcomes.md",
    "grok/intel/yahoo-ff-668216/2026/managers/behavior-notes-2026-W03.md",
    "grok/intel/yahoo-ff-668216/2026/quarantine/W03-vele-bid-display-conflict.md",
    "grok/intel/yahoo-ff-668216/2026/watchlist.md",
    "grok/intel/yahoo-ff-668216/INDEX.md",
    "grok/intel/yahoo-ff-668216/2026/runs/2026-09-23-wednesday-waiver-reconciliation.json"
  ],
  "commit_sha": "b8e597e15e1de33c3005734a0226a349cbcaa882",
  "delivery_status": "pending"
}
